{
  "receipt_id": "OzReceipt-dashboard-module-example",
  "result_id": "OzResult-dashboard-module-example",
  "truth_state_before": "claimed",
  "truth_state_after": "observed",
  "counter_results": [{ "counter_id": "c1", "status": "worked" }],
  "negative_memory": ["Planning output is not implementation proof."],
  "future_retrieval_tags": ["bug-cognizant", "dashboard", "standard"],
  "changed_route_if_any": null,
  "files_changed": ["future build surface map"],
  "commands_run": [],
  "verification": ["surface map includes future bug families"],
  "closed": true,
  "next_gate": "Use /oz-start for implementation."
}
